{
    "$schema": "http:\/\/json-schema.org\/draft-07\/schema#",
    "type": "object",
    "properties": {
        "endpoint_url": {
            "type": "string"
        },
        "actions": {
            "type": "array"
        },
        "event_id": {
            "type": "string"
        },
        "id": {
            "type": "string"
        },
        "resource_uri": {
            "type": "string"
        },
        "created": {
            "type": "string"
        },
        "user_id": {
            "type": "string"
        }
    },
    "required": [
        "endpoint_url"
    ],
    "meta": {
        "folder": "Webhooks",
        "filename": "postOrganizationWebhooks",
        "resourceName": "Create",
        "transition": "Create Webhooks by Organization ID",
        "transitionResponseTypes": {
            "200": "\\Eventbrite\\Model\\DataType\\Webhook"
        },
        "transaction": "httpTransaction",
        "messageType": "httpResponse",
        "resourceGroupName": "Webhooks",
        "resourceGroup": "\\Eventbrite\\Resource\\Webhooks",
        "transactionMethodName": "postOrganizationWebhooks",
        "responseStatusCode": 200,
        "responseType": "\\Eventbrite\\Model\\DataType\\Webhook"
    }
}